{
  "assumptions": [
    {
      "confidence": "low",
      "id": "assumption_2_supply_chain",
      "needs_evidence": true,
      "statement": "Supply chain resilience depends on explicit modeling of alternate sources rather than implicit assumptions of availability."
    }
  ],
  "expected_effects": [
    {
      "direction": "decrease",
      "metric": "scenario.total_unmet_delta",
      "rationale": "Alternate supply reduces unmet demand during primary blockage."
    },
    {
      "direction": "decrease",
      "metric": "resource_telemetry.resources.net_per_day",
      "rationale": "Net consumption fluctuates less with fallback protocols."
    }
  ],
  "focus_domain": "water_public_health",
  "hypothesis": "Alternate supply mechanisms must be activated explicitly when primary reserve nodes are compromised to prevent survival-critical demand spikes.",
  "id": "water_public_health_fallback_supply_protocol_v0",
  "intervention_type": "operating_protocol",
  "kind": "DiscoveryCandidateIntervention",
  "module_refs": [
    "water.resilient_water_commons.v0_1"
  ],
  "provisional": true,
  "rag_context": {
    "queries": [
      "CIaC water fallback supply protocols governance labor tracking"
    ],
    "required_sources": [
      "patterns/",
      "docs/module_reports/",
      "examples/generated/micro_commons_runtime_bundle.json",
      "examples/world_manifests/civic_floor_80_v0.world.json"
    ],
    "source_ids": [
      "examples/generated/micro_commons_runtime_bundle.json",
      "examples/generated/resident_exit_labor_loss_replay_simulation.json",
      "examples/generated/crop_failure_replay_simulation.json",
      "examples/generated/micro_commons_cycle_iteration.json",
      "examples/generated/micro_commons_simulation.json",
      "examples/generated/baseline_120d_simulation.json",
      "examples/generated/drought_reserve_v2_replay_simulation.json",
      "examples/generated/baseline_90d_simulation.json",
      "n8n:workflow:ciac_research_loop_webhook",
      "n8n:trace:n8n-rag-1779625577441"
    ]
  },
  "risk_tradeoffs": [
    {
      "mitigation": "Labor is tracked explicitly against available commons hours.",
      "risk": "Activation may incur labor overhead for distribution",
      "severity": "medium"
    }
  ],
  "simulation_hooks": {
    "acceptance_tests": [
      "No new survival-critical unmet demand is introduced.",
      "Labor shifts are tracked and approved.",
      "Governance rules regarding distribution remain explicit."
    ],
    "metrics_to_compare": [
      "resource_telemetry.resources.net_per_day",
      "resource_telemetry.labor.required_minutes_per_resident_per_day",
      "capabilities.domain_statuses"
    ],
    "scenarios_to_run": [
      "water_contamination_response_v2"
    ]
  },
  "source_loop_id": "discovery_civic_floor_730_v0_pop_730_pop_155_water_public_health_v0",
  "status": "generated",
  "target_objects": [
    "block_1__node_water_reserve",
    "block_2__node_water_reserve",
    "block_1__structure_common_house",
    "block_2__structure_common_house"
  ],
  "title": "Water fallback supply protocol",
  "version": "v0"
}
